342	[E11] ilovnate piramide [E12]: nekaj centimetrov ali decimetrov visoke [E21] piramide [E22] v ilovnatem jamskem dnu, ki jih je izdelala kapljajoča voda.	6	has	location	1
342	[E11] ilovnate piramide [E12]: nekaj centimetrov ali decimetrov visoke [E21] piramide [E22] v ilovnatem jamskem dnu, ki jih je izdelala kapljajoča voda.	0	has	cause	1
343	[E11] inkazija [E12]: [E21] preoblikovanje jamskega prostora [E22] zaradi jamskih podorov in drugih oblik rušenja skalovja. če se odlepi ob leziki del sklada, govorimo o skladovnem odlomu. če se odlomi skalni blok, je to blokovni odlom.	0	has	cause	1
344	[E11] jama [E12]: v širšem pomenu prehodna [E21] podzemeljska votlina [E22], ne glede na to, ali je vodoravna ali navpična (brezno). v ožjem smislu prehodna, pretežno horizontalna podzemeljska votlina; nasprotje brezna, ki je navpično. v splošni literaturi se rabi kraška jama, da ne bi prišlo do zamenjave z vdolbino na površju. v nekaterih slovenskih dialektih pomeni beseda jama brezno.	4	has	form	1
348	[E11] snežna jama [E12]: [E21] jama [E22], kjer se dolgo v poletje zadržuje v jamo zapadli sneg. cesto se odpira pod strmim pobočjem, od koder se plazilci vsipajo v jamo. sneg	6	has	location	1
349	[E11] ledena jama [E12], ledenica: [E21] jama [E22] žepaste oblike z vhodom iznad glavne votline. zato lahko priteka pozimi vanjo hladnejši zunanji zrak. v njej se velji del leta ali trajno zadržujejo ledene gmote. navadno je žepaste oblike tipa hladnice.	4	has	form	1
349	[E11] ledena jama [E12], ledenica: [E21] jama [E22] žepaste oblike z vhodom iznad glavne votline. zato lahko priteka pozimi vanjo hladnejši zunanji zrak. v njej se velji del leta ali trajno zadržujejo ledene gmote. navadno je žepaste oblike tipa hladnice.	0	has	cause	1
350	ledena jama, [E11] ledenica [E12]: [E21] jama [E22] žepaste oblike z vhodom iznad glavne votline. zato lahko priteka pozimi vanjo hladnejši zunanji zrak. v njej se velji del leta ali trajno zadržujejo ledene gmote. navadno je žepaste oblike tipa hladnice.	4	has	form	1
350	ledena jama, [E11] ledenica [E12]: [E21] jama [E22] žepaste oblike z vhodom iznad glavne votline. zato lahko priteka pozimi vanjo hladnejši zunanji zrak. v njej se velji del leta ali trajno zadržujejo ledene gmote. navadno je žepaste oblike tipa hladnice.	0	has	cause	1
354	[E11] erozijska jama [E12]: [E21] jama [E22], nastala pretežno z mehaničnim delovanjem tekoče vode (erozijo).	0	has	cause	1
356	[E11] fosilna jama [E12]: v preteklih geoloških razdobjih nastala [E21] jama [E22], ki se, danes ne oblikuje več. objekt fosilnega krasa (gl. fosilni kras).	0	has	cause	1
357	[E11] podorna jama [E12]: nastala s podiranjem. [E21] jama [E22] ali del jame s podornim skalovjem, oziroma so jo podori bistveno preoblikovali.	0	has	cause	1
358	[E11] rečna jama [E12]: [E21] jama [E22], po kateri teče reka ali potok. v širšem smislu vsaka jama, ki jo je izoblikoval vodni tok.	0	has	cause	1
359	[E11] lezična jama [E12]: [E21] jama [E22], ki kaže jasne znake nastanka ob leziki.	0	has	cause	1
360	[E11] kontaktna jama [E12]: [E21] jama [E22] na stiku različnih kamnin, često kraških in nekraških.	6	has	location	1
361	etažna jama, [E11] jama v nadstropjih [E12]: [E21] jama [E22], ki ima rove vidno razvrščene v dveh ali več nadstropjih (etažah), ki jih lahko povezujejo brezna ali skoki.	4	has	form	1
362	[E11] etažna jama [E12], jama v nadstropjih: [E21] jama [E22], ki ima rove vidno razvrščene v dveh ali več nadstropjih (etažah), ki jih lahko povezujejo brezna ali skoki.	4	has	form	1
363	[E11] hudourna jama [E12]: izraz je postal zgodovinski in etnološki. pomeni [E21] jamo [E22], iz katere so po starinskem verovanju prihajale nevihte s točo. naše hudourne jame je opisal j. v. valvasor.	2	has	result	1
365	[E11] tunelska jama [E12]: [E21] jama [E22], ki predira vzpetino od enega pobočja do drugega.	4	has	form	1
369	[E11] jamska ilovica [E12]: [E21] ilovica [E22] v jami. po nastanku avtohtona (nastala na licu mesta), paravtohtona (premeščena znotraj jame) ali alohtona (prinesena od zunaj).	6	has	location	1
369	[E11] jamska ilovica [E12]: [E21] ilovica [E22] v jami. po nastanku avtohtona (nastala na licu mesta), paravtohtona (premeščena znotraj jame) ali alohtona (prinesena od zunaj).	0	has	cause	1
372	[E11] jamska postaja [E12], jamsko nahajališce: [E21] jama [E22], v kateri so najdeni sledovi zadrževanja predzgodovinskega človeka. jame s sledovi bivanja v paleolitu so jamske paleolitske postaje. drug pomen za jamsko postajo: meteorološka postaja v jami.	6	has	location	1
373	jamska postaja, [E11] jamsko nahajališce [E12]: [E21] jama [E22], v kateri so najdeni sledovi zadrževanja predzgodovinskega človeka. jame s sledovi bivanja v paleolitu so jamske paleolitske postaje. drug pomen za jamsko postajo: meteorološka postaja v jami.	6	has	location	1
375	[E11] jamski podor [E12] (podor): [E21] podor [E22] skalovja v jamski steni ali stropu.	6	has	location	1
377	[E11] jamski udor [E12]: [E21] udor [E22], s katerim se jamski prostor odpre na površje.	2	has	result	1
378	[E11] jamski rov [E12]: del [E21] jame [E22], ki je mnogo bolj razvita veni smeri.	4	has	form	1
379	[E11] jamski sediment [E12]: [E21] sediment [E22] v jami, avtohtonega ali alohtonega porekla (kot npr. jamska ilovica – gl. jamska ilovica, siga, pesek itd.)	6	has	location	1
379	[E11] jamski sediment [E12]: [E21] sediment [E22] v jami, avtohtonega ali alohtonega porekla (kot npr. jamska ilovica – gl. jamska ilovica, siga, pesek itd.)	0	has	cause	1
380	[E11] jamsko okno [E12]: [E21] odprtina [E22] v jamskem stropu, skozi katero seva nebo.	6	has	location	1
381	jerina, [E11] rdeca zemlja [E12], terra rossa: rdečkasta [E21] zemlja [E22], ki je po prevladujočem naziranju v glavnem netopni ostanek karbonatov. značilna za submediteranski in mediteranski kras.	6	has	location	1
381	jerina, [E11] rdeca zemlja [E12], terra rossa: rdečkasta [E21] zemlja [E22], ki je po prevladujočem naziranju v glavnem netopni ostanek karbonatov. značilna za submediteranski in mediteranski kras.	4	has	form	1
381	jerina, [E11] rdeca zemlja [E12], terra rossa: rdečkasta [E21] zemlja [E22], ki je po prevladujočem naziranju v glavnem netopni ostanek karbonatov. značilna za submediteranski in mediteranski kras.	0	has	cause	1
382	jerina, rdeca [E11] zemlja [E12], [E21] terra rossa [E22]: rdečkasta zemlja, ki je po prevladujočem naziranju v glavnem netopni ostanek karbonatov. značilna za submediteranski in mediteranski kras.	5	form	has	2
382	jerina, rdeca [E11] zemlja [E12], [E21] terra rossa [E22]: rdečkasta zemlja, ki je po prevladujočem naziranju v glavnem netopni ostanek karbonatov. značilna za submediteranski in mediteranski kras.	1	cause	has	2
382	jerina, rdeca [E11] zemlja [E12], [E21] terra rossa [E22]: rdečkasta zemlja, ki je po prevladujočem naziranju v glavnem netopni ostanek karbonatov. značilna za submediteranski in mediteranski kras.	7	location	has	2
383	[E11] jerina [E12], rdeca [E21] zemlja [E22], terra rossa: rdečkasta zemlja, ki je po prevladujočem naziranju v glavnem netopni ostanek karbonatov. značilna za submediteranski in mediteranski kras.	6	has	location	1
383	[E11] jerina [E12], rdeca [E21] zemlja [E22], terra rossa: rdečkasta zemlja, ki je po prevladujočem naziranju v glavnem netopni ostanek karbonatov. značilna za submediteranski in mediteranski kras.	4	has	form	1
383	[E11] jerina [E12], rdeca [E21] zemlja [E22], terra rossa: rdečkasta zemlja, ki je po prevladujočem naziranju v glavnem netopni ostanek karbonatov. značilna za submediteranski in mediteranski kras.	0	has	cause	1
384	[E11] kal [E12]: večja [E21] vodna kotanja [E22], navadno trajno ali vsaj večji del leta z vodo napolnjena vrtača z nepropustnim dnom. to je redko prirodno nepropustno; navadno je pa tako šele po posegu človeka.	8	has	attribute	1
384	[E11] kal [E12]: večja [E21] vodna kotanja [E22], navadno trajno ali vsaj večji del leta z vodo napolnjena vrtača z nepropustnim dnom. to je redko prirodno nepropustno; navadno je pa tako šele po posegu človeka.	4	has	form	1
385	[E11] kalcit [E12]: [E21] mineral [E22], kalcijev karbonat caco3, ki kristalizira heksagonalno; osnovno gradivo apnenca.	4	has	form	1
386	[E11] kamin [E12]: [E21] odprtina [E22] v jamskem stropu, ki ji običajno ne vidimo konca.	6	has	location	1
387	[E11] kanal [E12]: nedostopen [E21] jamski rov [E22] v freatični coni; tudi dostopen enovit jamski rov brez bregov.	6	has	location	1
387	[E11] kanal [E12]: nedostopen [E21] jamski rov [E22] v freatični coni; tudi dostopen enovit jamski rov brez bregov.	8	has	attribute	1
388	[E11] kapelica [E12]: večja [E21] niša [E22] ali zaokrožena, bogato zakapana votlinica.	4	has	form	1
391	[E11] kevderc [E12]: ljudsko ime za manjšo [E21] jamo [E22], ki jo sestavlja ena sama manjša votlina.	4	has	form	1
393	koliševka, [E11] koleševka [E12]: več deset metrov globoka in široka [E21] kotanja [E22], običajno s skalnim, prepadnim pobočjem, z vidnim dnom. po prevladujočem naziranju je udornega postanka. ljudski izraz na notranjskem, kjer se javlja tudi ime koleševc.	4	has	form	1
393	koliševka, [E11] koleševka [E12]: več deset metrov globoka in široka [E21] kotanja [E22], običajno s skalnim, prepadnim pobočjem, z vidnim dnom. po prevladujočem naziranju je udornega postanka. ljudski izraz na notranjskem, kjer se javlja tudi ime koleševc.	0	has	cause	1
394	[E11] koliševka [E12], koleševka: več deset metrov globoka in široka [E21] kotanja [E22], običajno s skalnim, prepadnim pobočjem, z vidnim dnom. po prevladujočem naziranju je udornega postanka. ljudski izraz na notranjskem, kjer se javlja tudi ime koleševc.	4	has	form	1
394	[E11] koliševka [E12], koleševka: več deset metrov globoka in široka [E21] kotanja [E22], običajno s skalnim, prepadnim pobočjem, z vidnim dnom. po prevladujočem naziranju je udornega postanka. ljudski izraz na notranjskem, kjer se javlja tudi ime koleševc.	0	has	cause	1
395	[E11] kondenzacijska voda [E12]: [E21] voda [E22], ki se zaradi kondenzacije nabira v kapljicah na jamskih stenah ali stropu, navadno na mestu mešanja toplejšega in hladnejšega zraka.	6	has	location	1
395	[E11] kondenzacijska voda [E12]: [E21] voda [E22], ki se zaradi kondenzacije nabira v kapljicah na jamskih stenah ali stropu, navadno na mestu mešanja toplejšega in hladnejšega zraka.	0	has	cause	1
396	[E11] konta [E12]: uvala. visokogorska uvala. glaciokraška [E21] globel [E22], več deset ali sto metrov dolga in široka, običajno skledaste oblike. mnogokrat širša kot globlja. ljudsko ime v julijskih alpah, kjer je zelo pogosta.	6	has	location	1
396	[E11] konta [E12]: uvala. visokogorska uvala. glaciokraška [E21] globel [E22], več deset ali sto metrov dolga in široka, običajno skledaste oblike. mnogokrat širša kot globlja. ljudsko ime v julijskih alpah, kjer je zelo pogosta.	4	has	form	1
397	[E11] konvakuacija [E12]: [E21] širjenje [E22] votline (rova) zaradi izpraznjenja jamskih sedimentov. nastala votlina je konvakuacijska votlina.	2	has	result	1
397	[E11] konvakuacija [E12]: [E21] širjenje [E22] votline (rova) zaradi izpraznjenja jamskih sedimentov. nastala votlina je konvakuacijska votlina.	0	has	cause	1
398	[E11] biogena korozija [E12]: [E21] korozija [E22] pod vplivom organizmov.	0	has	cause	1
399	[E11] korozija mešanice [E12]: [E21] korozija [E22] mešanice temperaturno ali kemično neenakih vod, ki je postala po mešanju ponovno agresivna.	0	has	cause	1
400	[E11] aluvialna korozija [E12]: pospešena [E21] korozija [E22] karbonatne podlage, ki nastane zaradi premikanja vode skozi aluvialno odejo, bogato z ogljikovim dioksidom. je značilna za prepustna dna kraških polj in slepih dolin, ki jih poglablja.	6	has	location	1
400	[E11] aluvialna korozija [E12]: pospešena [E21] korozija [E22] karbonatne podlage, ki nastane zaradi premikanja vode skozi aluvialno odejo, bogato z ogljikovim dioksidom. je značilna za prepustna dna kraških polj in slepih dolin, ki jih poglablja.	2	has	result	1
400	[E11] aluvialna korozija [E12]: pospešena [E21] korozija [E22] karbonatne podlage, ki nastane zaradi premikanja vode skozi aluvialno odejo, bogato z ogljikovim dioksidom. je značilna za prepustna dna kraških polj in slepih dolin, ki jih poglablja.	0	has	cause	1
401	[E11] podtalna korozija [E12]: [E21] korozija [E22] karbonatne kamnine neposredno pod prstjo.	6	has	location	1
402	robna korozija, obrobna korozija, [E11] krajna korozija [E12]: [E21] korozija [E22] karbonatne kamnine ob robu neprepustne naplavine, zaradi katere so stene kotanj ali kraških polj na kraju ponikanja korozijsko izpodžrte. robna korozija razširja kraška polja, slepe doline, vrtače in druge kotanje z naplavljenim dnom. kotanj	6	has	location	1
402	robna korozija, obrobna korozija, [E11] krajna korozija [E12]: [E21] korozija [E22] karbonatne kamnine ob robu neprepustne naplavine, zaradi katere so stene kotanj ali kraških polj na kraju ponikanja korozijsko izpodžrte. robna korozija razširja kraška polja, slepe doline, vrtače in druge kotanje z naplavljenim dnom. kotanj	2	has	result	1
403	robna korozija, [E11] obrobna korozija [E12], krajna korozija: [E21] korozija [E22] karbonatne kamnine ob robu neprepustne naplavine, zaradi katere so stene kotanj ali kraških polj na kraju ponikanja korozijsko izpodžrte. robna korozija razširja kraška polja, slepe doline, vrtače in druge kotanje z naplavljenim dnom. kotanj	6	has	location	1
403	robna korozija, [E11] obrobna korozija [E12], krajna korozija: [E21] korozija [E22] karbonatne kamnine ob robu neprepustne naplavine, zaradi katere so stene kotanj ali kraških polj na kraju ponikanja korozijsko izpodžrte. robna korozija razširja kraška polja, slepe doline, vrtače in druge kotanje z naplavljenim dnom. kotanj	2	has	result	1
404	[E11] robna korozija [E12], obrobna korozija, krajna korozija: [E21] korozija [E22] karbonatne kamnine ob robu neprepustne naplavine, zaradi katere so stene kotanj ali kraških polj na kraju ponikanja korozijsko izpodžrte. robna korozija razširja kraška polja, slepe doline, vrtače in druge kotanje z naplavljenim dnom. kotanj	6	has	location	1
404	[E11] robna korozija [E12], obrobna korozija, krajna korozija: [E21] korozija [E22] karbonatne kamnine ob robu neprepustne naplavine, zaradi katere so stene kotanj ali kraških polj na kraju ponikanja korozijsko izpodžrte. robna korozija razširja kraška polja, slepe doline, vrtače in druge kotanje z naplavljenim dnom. kotanj	2	has	result	1
405	[E11] ploskovna korozija [E12]: [E21] korozija [E22], ki enakomerno učinkuje na površje, ustvarja gladke skalne ploskve; tudi korozija, ki enakomerno znižuje površje. ploskve	8	has	attribute	1
405	[E11] ploskovna korozija [E12]: [E21] korozija [E22], ki enakomerno učinkuje na površje, ustvarja gladke skalne ploskve; tudi korozija, ki enakomerno znižuje površje. ploskve	2	has	result	1
406	[E11] pospešena korozija [E12]: [E21] korozijski proces [E22], ki lokalno hitreje poglablja površje in lahko ustvarja kotanje.	2	has	result	1
407	[E11] linearna korozija [E12]: [E21] korozija [E22], ki deluje linearno in ustvarja linearne (to je v določeni smeri razporejene) depresijske površinske oblike.	2	has	result	1
408	[E11] korozijska vdolbinica [E12]: do nekaj centimetrov ali decimetrov široka in globoka skalna [E21] vdolbinica [E22], nastala zaradi različnih vrst korozije. pod preperino je širša in plitvejša.	4	has	form	1
408	[E11] korozijska vdolbinica [E12]: do nekaj centimetrov ali decimetrov široka in globoka skalna [E21] vdolbinica [E22], nastala zaradi različnih vrst korozije. pod preperino je širša in plitvejša.	0	has	cause	1
409	[E11] korozijski vdolbek [E12]: nekaj dm široka in globoka ovalna [E21] vdolbinica [E22] v apneniški skali pod prstjo (zemljo, preperino). ena od oblik podtalnega krasa.	6	has	location	1
409	[E11] korozijski vdolbek [E12]: nekaj dm široka in globoka ovalna [E21] vdolbinica [E22] v apneniški skali pod prstjo (zemljo, preperino). ena od oblik podtalnega krasa.	4	has	form	1
410	[E11] korozijska stopnička [E12]: polkrožna [E21] izjedenina [E22], podobna odtisu pete, ki je specifičen pojav razčlenjenih golih, največkrat visokogorskih skalnatih površin. nastaja z omejeno retrogradno ploskovno korozijo. ploskovno korozijo	6	has	location	1
410	[E11] korozijska stopnička [E12]: polkrožna [E21] izjedenina [E22], podobna odtisu pete, ki je specifičen pojav razčlenjenih golih, največkrat visokogorskih skalnatih površin. nastaja z omejeno retrogradno ploskovno korozijo. ploskovno korozijo	4	has	form	1
410	[E11] korozijska stopnička [E12]: polkrožna [E21] izjedenina [E22], podobna odtisu pete, ki je specifičen pojav razčlenjenih golih, največkrat visokogorskih skalnatih površin. nastaja z omejeno retrogradno ploskovno korozijo. ploskovno korozijo	0	has	cause	1
411	[E11] korozijski relief [E12]: [E21] relief [E22], nastal s prevladujočim korozijskim procesom in so zanj značilne korozijske reliefne oblike.	0	has	cause	1
412	[E11] kotlica [E12]: okroglasta [E21] vdolbina [E22] gladkih sten s premerom nekaj centimetrov ali decimetrov, v stropu, na steni ali dnu jame. poznamo korozijsko in erozijsko kotlico.	6	has	location	1
412	[E11] kotlica [E12]: okroglasta [E21] vdolbina [E22] gladkih sten s premerom nekaj centimetrov ali decimetrov, v stropu, na steni ali dnu jame. poznamo korozijsko in erozijsko kotlico.	4	has	form	1
413	[E11] korozijski ravnik [E12]: [E21] kraški ravnik [E22], ki je nastal pretežno s korozijskimi procesi. prim. kraški ravnik.	0	has	cause	1
414	[E11] kotlič [E12]: skalnata [E21] globel [E22] okroglaste, podolgovate ali oglate oblike s premerom nekaj metrov, s strmimi stenami in snegom, ki se zadržuje v dnu večino leta. značilen za visokogorski kras (kunaver, 1962).	6	has	location	1
414	[E11] kotlič [E12]: skalnata [E21] globel [E22] okroglaste, podolgovate ali oglate oblike s premerom nekaj metrov, s strmimi stenami in snegom, ki se zadržuje v dnu večino leta. značilen za visokogorski kras (kunaver, 1962).	4	has	form	1
415	[E11] kras [E12]: pri drugih neslovenskih narodih karst (tudi rusko), pri čehih, slovakih, poljakih kras. [E21] ozemlje [E22], kjer vlada zaradi razpoklinske prepustnosti kamnine podzemeljsko (kraško) pretakanje vode, učinkovito kemično raztapljanje kamnin in kjer so lahko razvite tudi značilne površinske in podzemeljske oblike. beseda je predindoevropskega izvora (carra = kamen) in je bila do srede 19. stol. samo pokrajinsko ime za regijo kras med tržaškim zalivom in vipavsko dolino. največ s posredovanjem avstrijske strokovne literature je postala v obliki karst mednarodni termin.	8	has	attribute	1
416	[E11] matični kras [E12]: [E21] kras [E22] kraške pokrajine med tržaškim zalivom in vipavsko dolino v regiji, ki jo imenujemo kras in katere ime je prešlo v krasoslovno terminologijo kot geomorfološki termin.	8	has	attribute	1
417	[E11] klasični kras [E12]: [E21] kraško ozemlje [E22] med trstom, kvarnerskim zalivom in postojno, katerega kraške značilnosti so bile prvič strokovno opisane. v širšem pomenu ozemlje z izrazitimi kraškimi pojavi. ozemlje	8	has	attribute	1
425	[E11] glaciokras [E12]: [E21] površinski kras [E22], ki je nastal ob delovanju kraških in glacialnih procesov. kras	0	has	cause	1
426	srednejevropski kras, [E11] kras jure [E12], moravski tip: [E21] kras [E22] s suhimi dolinami na planotastem nizkem reliefu in z redkimi drugimi kraškimi pojavi na površju.	6	has	location	1
427	srednejevropski kras, kras jure, [E11] moravski tip [E12]: [E21] kras [E22] s suhimi dolinami na planotastem nizkem reliefu in z redkimi drugimi kraškimi pojavi na površju.	6	has	location	1
428	[E11] srednejevropski kras [E12], kras jure, moravski tip: [E21] kras [E22] s suhimi dolinami na planotastem nizkem reliefu in z redkimi drugimi kraškimi pojavi na površju.	6	has	location	1
429	[E11] subnivalni kras [E12]: [E21] kras [E22] v višinskem ali subarktičnem pasu, kjer sneg kot očitni morfogenetski dejavnik skopni le čez poletje, tudi pas pod nivalnim krasom ali gozdnati pas, kjer je v glacialnih dobah nastal nivalni kras.	6	has	location	1
429	[E11] subnivalni kras [E12]: [E21] kras [E22] v višinskem ali subarktičnem pasu, kjer sneg kot očitni morfogenetski dejavnik skopni le čez poletje, tudi pas pod nivalnim krasom ali gozdnati pas, kjer je v glacialnih dobah nastal nivalni kras.	0	has	cause	1
430	subpolarni kras, [E11] subarktični kras [E12]: [E21] kras [E22], nastal v subpolarni (subarktični) klimi.	0	has	cause	1
431	[E11] subpolarni kras [E12], subarktični kras: [E21] kras [E22], nastal v subpolarni (subarktični) klimi.	0	has	cause	1
432	[E11] tropski kras [E12]: [E21] kras [E22], nastal v trajno ali sezonsko vlažni tropski klimi. v starejši literaturi sinonim za kegelkarst. značilne zanj so strme vzpetine (stogi, stolpi).	0	has	cause	1
433	[E11] goli kras [E12]:. kras, katerega površje je po veliki večini kamnito. v rabi je tudi pojmovanje, da je goli kras ozemlje brez zelenja ali [E21] kamnito ozemlje [E22] brez zelenja.	10	defined	as	1
435	[E11] polgoli kras [E12], polpokriti kras: [E21] kras [E22], kjer se prepletajo gole in pokrite kraške površine. prehodna oblika med golim in pokritim krasom.	10	defined	as	1
436	polgoli kras, [E11] polpokriti kras [E12]: [E21] kras [E22], kjer se prepletajo gole in pokrite kraške površine. prehodna oblika med golim in pokritim krasom.	10	defined	as	1
438	[E11] čokati kras [E12]: [E21] polpokriti kras [E22], kjer molijo na površje čokati kamni, visoki do enega metra in več.	4	has	form	1
439	[E11] kozavi kras [E12]: [E21] kras [E22] s tako gostimi vrtačami, da spominja na kožo človeka, ki je prebolel koze.	8	has	attribute	1
440	[E11] poligonalni kras [E12]: [E21] kras [E22], kjer so kraške kotanje, nastale z zraščanjem vrtač, iz zraka vidne kot poligonalna mreža. pogojen je s “ parketnim ” razporedom tektonskih prepok. pogost v tropskem krasu.	6	has	location	1
440	[E11] poligonalni kras [E12]: [E21] kras [E22], kjer so kraške kotanje, nastale z zraščanjem vrtač, iz zraka vidne kot poligonalna mreža. pogojen je s “ parketnim ” razporedom tektonskih prepok. pogost v tropskem krasu.	4	has	form	1
440	[E11] poligonalni kras [E12]: [E21] kras [E22], kjer so kraške kotanje, nastale z zraščanjem vrtač, iz zraka vidne kot poligonalna mreža. pogojen je s “ parketnim ” razporedom tektonskih prepok. pogost v tropskem krasu.	0	has	cause	1
441	[E11] fluviokras [E12]: [E21] kras [E22], katerega površje je izoblikoval fluvialni proces (erozija, denudacija), čeprav je bila korozija znatna, vendar ne odločilna za relief. kras kraških polj in podolijl. kras, kjer so kraška polja in povezane suhe doline - podolja - poglavitne kraške značilnosti površja (npr. kras notranjskega podolja).	0	has	cause	1
442	[E11] rebrasti kras [E12]: [E21] polgoli kras [E22], kjer molijo na površje podolgovati kamni rebraste oblike do enega metra in več. često so to cela odpornejših skladov.	4	has	form	1
444	stožčasti kras, [E11] stogasti kras [E12]: posebna oblika [E21] tropskega krasa [E22] z značilnimi vzpetinicami v obliki stožcev (stogov).	10	defined	as	1
445	[E11] stožčasti kras [E12], stogasti kras: posebna oblika [E21] tropskega krasa [E22] z značilnimi vzpetinicami v obliki stožcev (stogov).	10	defined	as	1
447	[E11] holokarst [E12]: po cvijiču popolni, globoki [E21] kras [E22] z vsemi kraškimi pojavi, vključno polji. nasprotje od merokrasa. tudi dinarski tip krasa.	8	has	attribute	1
448	[E11] merokras [E12]: po cvijiču delni, nepopolni [E21] kras [E22]. sinonim za srednjeevropski kras.	6	has	location	1
448	[E11] merokras [E12]: po cvijiču delni, nepopolni [E21] kras [E22]. sinonim za srednjeevropski kras.	8	has	attribute	1
449	[E11] parakras [E12]: [E21] kras [E22] z neizrazitimi kraškimi oblikami, v kamninah, kot je dolomit, ki le delno podlegajo zakrasevanju. pogosto ime v italijanskem krasoslovju.	0	has	cause	1
450	[E11] podzemeljski kras [E12], endokras: [E21] kraški pojavi [E22] pod zemeljskim površjem, oziroma pod zemljo (prstjo). nasprotje: površinski kras, eksokras, jug., int: eksokarst. kras na zemeljskem površju. površjem	6	has	location	1
451	podzemeljski kras, [E11] endokras [E12]: [E21] kraški pojavi [E22] pod zemeljskim površjem, oziroma pod zemljo (prstjo). nasprotje: površinski kras, eksokras, jug., int: eksokarst. kras na zemeljskem površju. površjem	6	has	location	1
452	[E11] visokogorski kras [E12]: [E21] kras [E22] v gorah nad gozdno mejo.	6	has	location	1
453	kontaktni kras, [E11] stični kras [E12]: [E21] kras [E22] na sticišču prepustnih in vodno neprepustnih kamnin.	6	has	location	1
454	[E11] kontaktni kras [E12], stični kras: [E21] kras [E22] na sticišču prepustnih in vodno neprepustnih kamnin.	6	has	location	1
455	[E11] obalni kras [E12]: [E21] površinski kras [E22] na morski ali jezerski obali. kras obali	6	has	location	1
456	[E11] globoki kras [E12]: [E21] kras [E22] z več sto metrov debelo cono vertikalnega kraškega pretakanja. kras, kjer najgloblje reliefne depresije ne dosegajo freatične cone. po drugem pojmovanju kras z več sto metrov debelimi kraškimi kamninami ne glede na globino piezometra. pretakanja depresije kamninami	4	has	form	1
457	[E11] fosilni kras [E12]: [E21] ohranjeni ostanki krasa [E22], ki je nastal z zanj tipičnimi oblikami v drugačnih klimatskih in drugih pogojih v geološki preteklosti in je zastal v razvoju. kraške oblike, ki niso v skladu z recentnim zakrasevanjem. v slovenski kraški literaturi tudi tiste kraške oblike, katerih razvoj je v recentni dobi povsem zastal (prim. fosilna jama, fosilno brezno, mrtva jama).	8	has	attribute	1
